{
  "version": 1,
  "caller_session_id": "00000000-0000-4000-8000-000000000055",
  "scope_sha256": "973b622f5028573ef6c213f8760690763738e33708730787c63b570fe24ee1a9",
  "boundary": "scoped-admission",
  "content_policy": "public-v1",
  "match_policy": "public-content-literal-v1",
  "ordering": "occurrences-desc,length-asc,time-desc,session-id-asc,seq-desc",
  "returned_count": 0,
  "capped": false,
  "items": []
}
